title,seg
下一隻汽車共享獨角獸 Turo，去年營收成長 59% 營收突破 7 億美元,
別偷 AirPods 耳機，它基本上就是個 AirTag,
IBM 加拿大投資為第一步，美加計劃發展「雙邊半導體走道」,
退休年齡延至 64 歲，引發法國百萬人上街抗議,
污水處理不再昂貴困難，以木材輕鬆去除 80% 染料有毒物,
郭明錤：AirPods Pro 2 將推 USB-C 版，平價版似乎暫沒計畫,
全台第三座離岸風場啟動，海能風場 376MW 全數完工併聯,
美國最新研究發現！阿茲海默症早期徵兆可能在眼睛裡,
恐慌蔓延慘遭殃及，分析師強調：德意志銀行不是下個瑞士信貸,
生產移出中國，傳蘋果供應商和碩將在印度設第二廠,
華府制裁使中國不僅取得晶片難，登月計畫也受挫,
英特爾聯合創辨人，摩爾定律發明人 Gordon Moore 辭世，享耆壽 94 歲,
Blue Origin 公布去年 9 月火箭事故調查結果，預計今年底前恢復飛行,
美記者獲准參訪台積電，盛讚半導體技術達神境界,
Polestar 2 擊敗特斯拉 Model 3Y，成為德國最受歡迎公司車,
不滿 64 歲才能退休，法國百萬人上街抗爭,
污水處理不再昂貴困難，以木材輕鬆去除 80% 染料有毒物,
郭明錤：AirPods Pro 2 將推 USB-C 版，平價版似乎暫沒計畫,
全台第三座離岸風場啟動，海能風場 376MW 全數完工併聯,
美國最新研究發現！阿茲海默症早期徵兆可能在眼睛裡,
恐慌蔓延慘遭殃及，分析師強調：德意志銀行不是下個瑞士信貸,
生產移出中國，傳蘋果供應商和碩將在印度設第二廠,
華府制裁使中國不僅取得晶片難，登月計畫也受挫,
英特爾聯合創辨人、摩爾定律發明人 Gordon Moore 辭世，享耆壽 94 歲,
Blue Origin 公布去年 9 月火箭事故調查結果，預計今年底前恢復飛行,
美記者獲准參訪台積電，盛讚半導體技術達神境界,
Polestar 2 擊敗特斯拉 Model 3  Y，成德國最受歡迎公司車,
台積電總裁魏哲家獲 400 張限制股票，市值 2.156 億元,
高雄 330 起水情橙燈，科學園區總量管制節水 10%,
貝佐斯親自提案 Alexa、無人超市都被裁，為何驚世創意行不通？,
台灣產業無懼「去台化」，半導體帶頭衝開創全球大國民格局,
網友產生川普被捕圖瘋傳，Midjourney 暫停其使用權限,
"全球僅 1,002 人獲頭銜，台灣就有 14 位！揭密 Google 最神祕專家計畫「開發者專家群」",
友達拚轉型三家公司最關鍵，彭双浪：2025 年非面板營收超過二成,
高盛研究用生成式 AI 工具協助系統開發,
全球電動車市場快速成長下，伴隨各種資安風險,
用想的就好，澳洲開發機器狗腦波控制技術,
科學家狂想？嚴酷行星的晨昏交界處可能有生命,
Ivacy VPN 限時優惠，每月僅需 1 美元解鎖 Netflix、Hulu 地區限制,
搶電費上漲、節能補助商機！東元商用空調第三季出貨估年成長 40%,
中國私募基金曾嘗試併購，南韓 OLED DDIC 大廠 MagnaChip 裁員,
SpaceX 升級的星鏈 V2 mini 版衛星，進入太空後表現不佳,
蘋果 Micro LED 專利申請，很可能用於 Apple Watch？,
慧洋每股配發現金股利 6.5 元！配發率 46%、殖利率 10.2%,
華碩人工智慧內視鏡病灶輔助系統強化檢出大腸癌機率,
Q3 全球庫存見底？Trafigura：銅價可能飆歷史高,
傳蘋果將年砸 10 億美元進軍大螢幕，戲院類股嗨,
PS5 日本銷量暴減四成，8 週來首輸 Switch,
印度官員：台積電、英特爾、三星都有興趣到印度投資設廠,
中華電響應「Earth Hour 關燈 1 小時」，全台近 700 間門市同步呼應,
打回 1947，俄軍開始將 T-54 戰車送往烏克蘭前線,
印度 IT 是 India＋Taiwan！劉揚偉：台灣一定要把握機會,
台積電人才願景首度公開，跨國人才管理是巨大挑戰,
真菌禍害敲警鐘，科學家稱暖化讓真菌加速突變,
"普發現金登記入帳，小孩怎麼領這 6,000 元？",
不怕打消庫存、美光股價彈，外資：記憶體將落底,
太陽表面出現日冕「大洞」，預計引發 G2 級地磁風暴,
入職 2 個月晉升 TikTok 執行長，獨扛國會猛烈砲火的周受資是誰？,
科技業寒冬還沒到頭，埃森哲將砍 1.9 萬人,
人工智慧開始工作，ChatGPT 官方外掛可訂機票、食材,
三星李在鎔 4 月赴美會見 Lucid 高層，討論電池供應,
Arm 傳漲價改商模，為哪齣？真的可行？,
東芝逆衝 5%，接受日企聯盟收購提案、總額 2 兆日圓,
郭明錤：Power Integrations 為蘋果 20W USB-C 充電器晶片獨家供應商,
二十年來未有的大挑戰，光陽還能重回冠軍寶座嗎？,
Google 前員工組新創攻 AI 聊天機器人，創投大咖注資,
全球貿易熄火，唯獨電動車、風機貿易逆勢成長,
美國將 14 家中企列入未經核實清單，出口商發貨前須審慎調查,
戴琪：與中國貿易對話持開放態度，目標捍衛美利益,
從瑞薩看車用半導體市場,
東研信超上櫃首日大漲 36%！中籤可望獲利 2.49 萬元入袋,
中國 3 月 86 款遊戲獲批，版號發放數量／頻率趨穩定,
頂多是白領助理，比爾蓋茲：AI 對工作影響沒那麼戲劇化,
中國伸腳？英特爾收購高塔半導體將無法如期完成,
寒流還沒結束，「景氣風向球」沃爾瑪出手裁員,
記憶體兩樣情，外資看好 NAND 與 Nor 表現，對矽晶圓與設備較保守,
福特警告今年電動車事業恐虧 30 億美元，股價小跌,
歸類為 ChatGPT 概念股狂飆！外資喊買宜鼎目標價 332 元,
華為推新款旗艦機，打破出售手機業務傳言,
輝達市值超車波克夏，黃仁勳：摩爾定律已死有解,
京東方生產出包？傳蘋果向三星追加 iPhone 14 OLED 訂單,
抓到了！逃亡 10 個月，Terra 創辦人 Do Kwon 終於落網,
國會聽證激烈交鋒，TikTok 未化解生存危機,
缺水進入假死狀態的水熊蟲，隱藏儲存生物製劑另類潛力,
日本 323 起放寬出口管制，韓擬讓日重返「白色國家」,
楊金龍「適度緊縮」鴿派升息，半碼決策 9 問答一次看,
ChatGPT 洩漏他人對話紀錄，OpenAI 坦承錯誤並修正,
金管會：180 名財管及複委託客戶，踩雷瑞信 AT1 逾 18 億,
Telegram「截圖釣魚」詐騙肆虐！如何設定 2FA 雙重驗證、被盜怎麼辦？,
ChatGPT 嚴重衝擊 19% 工作，OpenAI：收入越高影響越大,
ChatGPT 嚴重衝擊 19% 工作，OpenAI：收入越高影響越大,
顛覆想像，德國修道院士推出沖泡式零酒精「啤酒粉」,
法拉利系統遭入侵，客戶資料被盜,
台灣飛彈實力絕對有全球前三！不投資「邪惡產業」的挪威主權基金為何大買台灣軍工股？,
興登堡做空支付公司 Block，股價暴跌近 15%,
醫療行政負荷大解放！微軟子公司推出整合 GPT-4 的門診內容自動轉寫技術,
大腦與電腦結合！科學家用 8 萬個鼠腦細胞建構「活體電腦」,
AT&S 調整馬來西亞廠投資計畫，ABF 載板長期需求面臨下修,
Gogoro 與 foodpanda 合作，於新加坡推行電動機車換電系統,
團隊協作新想像，微軟推出激似 Notion 新工具,
看好生成式 AI 潛力，中華電有望從客戶服務切入應用,
童子賢：AI 還在中學階段未成熟，取代哪些產業不可知,
全球首枚 3D 列印火箭成功發射，惜未進入軌道,
意外偏「鷹」連五升！央行總裁楊金龍宣布升息半碼,
數位轉型支持戴爾伺服器業績成長，全球裁員不影響市場發展,
全球首枚 3D 列印火箭成功發射，惜未進入軌道,
意外偏「鷹」連五升！央行總裁楊金龍宣布升息半碼,
數位轉型支持戴爾伺服器業績成長，全球裁員不影響市場發展,
GitHub 推出支援 GPT-4 新版 Copilot，工程師動口就可開發程式,
Arm 傳打算大幅調高權利金，已知會聯發科、高通,
瞄準醫療、智慧平台千億美元商機！睿生光電 327 以 70 元掛牌上市,
AI 繪圖太直譯引熱議，百度：文生圖會快速更新,
半導體業不景氣，南韓驅動 IC 廠美格納縮減人力,
動盪結束？傳東芝接受 JIP 約 2 兆日圓收購要約,
Siegel：人們若重新信任銀行，比特幣將再次回落,
分析師看好電池類股成長空間高達 70%，但有三家要謹慎評估,
Fed 鴿式升息 1 碼符合預期！法人：台股逢低布局兩大類股,
政府信心喊話民眾仍憂，近 16 美國人火速轉移資金,
鮑爾最艱難的決策！打通膨或穩金融 Fed 陷入拉鋸,
外資：輝達搶得 AI 主導地位，將重塑科技業面貌,
全宇 2022 年每股賺 5.75 元！決議配發每股現金股利 2.5 元,
經濟環保又能發電，新一代自我感測超材料混凝土登場,
蘋果加州自駕車隊司機人數增加，2 月試駕時發生碰撞,
Luminar 今年大漲三成，高盛籲獲利了結，股價摔 14%,
美運輸業對下半年不敢抱期待？零售、鐵路商喊苦,
更難處理雙重任務，哈佛研究：人類大腦 55 歲就開始衰老,
重塑行銷工作流程，Adobe 推生成式 AI 服務 Sensei GenAI,
潛力完全開發，大型強子對撞機證實首檢測到高能微中子,
熙特爾新能源聯手施耐德電機，打造一站式數位儲能節能方案,
哪些算傳統晶片？美國商務部列出超嚴格規範,
使用 AI 訓練類人腦細胞，科學家：生物電腦可突破技術極限,
比 10 座足球場還大，住友橡膠打造 22MW 世界最大太陽能屋頂,
輝達黃仁勳看好 AI 成長力道，台積電等概念股揚升,
ChatGPT 擴充功能夾帶惡意外掛，竊取 Facebook 帳號,
憂與華為過度密切，德政府擬審查德國電信,
聯準會終端利率峰值將現！法人：美國百大債後市利好,
葉倫無意為銀行存款提供全面擔保，美國中小型銀行不滿,
晶片戰與審查制度夾擊，中國科技巨擘發展聊天機器人遇阻,
OpenAI 助攻、微軟 Bing 變夯，迎戰 Google,
蘋果再度出手打擊遠距工作，追蹤員工出勤紀錄,
下半年復甦力道不如預期，外資調降台積電、聯電、聯發科目標價,
雲端伺服器第二季庫存去化完！外資看好出貨同比個位數成長,
LG 打入電動車新創 Lucid 供應鏈，生產 30 吋 OLED 面板,
福特將改財報結構，投資人最關心電動車虧多少,
日本地價增幅 15 年來最大，台積電效應致菊陽町猛增,
拆彈如火如荼，小摩 CEO 急赴華府會見白宮經濟高官,
疫後電腦設備需求降低，羅技全球重組裁員 300 人,
日本 10 年債殖利率升幅 2 個半月來最大，日圓彈升,
美國證交會準備對 Coinbase 採取法律行動，股價大跌 22%,
地球的水從何而來？研究指不是來自熔化的隕石,
